{
  "id": "trl.l.starter-recon",
  "name": "Trollbloods Starter",
  "faction": "trl",
  "level": "recon",
  "points": 28,
  "leader": "trl.gunnbjorn",
  "entries": [
    {
      "profile": "trl.bomber"
    },
    {
      "profile": "trl.braylen",
      "advanceDeploy": true
    },
    {
      "profile": "trl.highwaymen",
      "size": 5,
      "advanceDeploy": true
    }
  ],
  "source": "2017 Trollbloods Army Box trimmed to 28 pts (no MK4 Trollbloods starter); see trollbloods-sources.md"
}
